title,ingredients,instructions,yield,time,notes,author,source_url,error
Mole-Spiced Ribs With Orange and Pickled Onion,"['5 whole star anise', '1 Tbsp. coriander seeds', '1 Tbsp. cumin seeds', '1 Tbsp. mustard seeds', '1½ tsp. whole cloves', '4 dried chiles de árbol or 2 tsp. crushed red pepper flakes', '2 guajillo chiles, seeds removed', '3 Tbsp. toasted sesame seeds, divided', '¼ cup ground sumac', '4 tsp. unsweetened cocoa powder', '1¼ tsp. ground cinnamon', '1 tsp. ground allspice', '1 tsp. ground coffee', '2 2½-lb. racks St. Louis–style pork spareribs', 'Kosher salt', '½ medium red onion, thinly sliced', '⅓ cup red wine vinegar', '2 tsp. sugar', '12 oz. kombucha (about 1½ cups)', '4 garlic cloves, thinly sliced', '1 medium white onion, cut into 2"" pieces', '2 medium oranges, cut into 2"" pieces (peel and all), divided', 'Cilantro sprigs (for serving)']","['Toast star anise, coriander seeds, cumin seeds, mustard seeds, and cloves in a dry small skillet over medium heat, tossing occasionally, until very fragrant and just beginning to darken, about 5 minutes. Transfer to a plate; let cool. Finely grind in spice mill or with mortar and pestle; transfer to a bowl. Finely grind chiles de árbol, guajillo chiles, and half of sesame seeds. Add to ground spices along with sumac, cocoa powder, cinnamon, allspice, coffee, and remaining sesame seeds; mix well.', 'Mole powder can be made 2 weeks ahead. Store airtight at room temperature.', 'Season ribs all over with salt (we recommend 1¼ tsp. Diamond Crystal or ¾ tsp. Morton kosher salt per lb.) and sprinkle with ½ cup mole powder, pressing to adhere. Arrange on a rimmed baking sheet and let chill, uncovered, overnight.', 'Place racks in upper and lower thirds of oven; preheat to 300°. Mix red onion, vinegar, sugar, and a few pinches of salt in a medium bowl; set aside.', 'Transfer ribs to a deep roasting pan and pour in kombucha. Scatter garlic over and arrange white onion and half of orange pieces around ribs. Cover pan tightly with foil; bake on lower rack until tender but not falling apart, 2½–3 hours.', 'Remove ribs from oven. Heat broiler. Uncover ribs and broil on upper rack, turning once, until crisp, about 5 minutes.', 'Transfer ribs to a platter. Skim fat from liquid in pan and discard; drizzle liquid over ribs. Top with drained pickled red onion, cilantro, and remaining orange.']",8 servings,"{'prep': 'Overnight chilling', 'cook': '2½–3 hours', 'total': 'Overnight chilling + 2½–3 hours cooking'}","Sumac can be found at Middle Eastern markets, specialty foods stores, and online.",Carla Perez-Gallardo and Hannah Black,https://www.bonappetit.com/recipe/mole-spiced-ribs-with-orange-and-pickled-onion?utm_campaign=likeshopme&client_service_id=31198&utm_social_type=owned&utm_brand=ba&service_user_id=1.78e+16&utm_content=instagram-bio-link&utm_source=instagram&utm_medium=social&client_service_name=bonappetitmag&supported_service_name=instagram_publishing,
,,,,,,,https://www.galatoires.com/about/recipes,Expecting value: line 1 column 1 (char 0)
,,,,,,,https://www.halfbakedharvest.com/one-skillet-greek-meatballs-and-lemon-butter-orzo/#bo-recipe,Expecting value: line 1 column 1 (char 0)
Rosy Harissa Chicken,"['3/4 cup kefir or plain whole-milk Greek yogurt', '1/4 cup fresh lemon juice', '3 tablespoons plus 2 teaspoons harissa paste (such as New York Shuk), divided', '1 tablespoon plus 1 teaspoon kosher salt, divided', '1 tablespoon fresh thyme leaves plus 4 thyme sprigs, divided', '2 teaspoons grated garlic', '1 tablespoon black pepper, divided', '4 (10-ounce) chicken leg quarters', '2 large shallots, halved', '1 garlic head, halved crosswise', '1 small lemon, halved', '1/4 cup water', '1 tablespoon rose-harissa spice blend (such as New York Shuk) or paprika', '2 tablespoons dried edible rose petals or rose buds (optional)']","['Whisk together kefir, lemon juice, 3 tablespoons harissa paste, 1 tablespoon salt, thyme leaves, grated garlic, and 2 teaspoons pepper. Place chicken quarters in a large ziplock plastic bag. Pour kefir mixture over chicken, and seal bag. Refrigerate at least 8 hours or up to 24 hours, turning bag occasionally.', 'Preheat oven to 375°F with oven rack in upper third of oven. Let chicken stand at room temperature 30 minutes. Scatter shallots, garlic, and lemon halves, cut sides down, in a heavy-duty roasting pan or 13- x 9-inch baking dish. Add thyme sprigs. Remove chicken from marinade, allowing excess marinade to drip off. Discard marinade. Sprinkle chicken with remaining 1 teaspoon salt and remaining 1 teaspoon pepper; arrange chicken, skin sides up, in a single layer in roasting pan. Add 1/4 cup water to pan.', 'Roast chicken in preheated oven until a meat thermometer inserted in thickest portion registers 140°F, 30 to 35 minutes. Turn broiler to high. Baste chicken with pan juices, and sprinkle chicken with rose-harissa spice blend. Broil, basting chicken with pan juices every 2 to 3 minutes, until thermometer registers 165°F, 8 to 10 minutes.', 'Transfer chicken to a channeled cutting board; let rest 10 minutes. Meanwhile, squeeze 1 roasted lemon half and 6 roasted garlic cloves into pan juices; reserve remaining lemon half for serving and remaining garlic cloves for another use. Mash shallots and garlic with pan juices.']",4,"{'prep': '30 mins', 'cook': '1 hr 25 mins', 'total': '1 hr 55 mins'}",Serve with crusty bread or Israeli couscous to sop up the sauce.,Susan Spungen,https://www.foodandwine.com/recipes/rosy-harissa-chicken?utm_source=instagram&utm_medium=social&utm_campaign=foodandwine_foodandwine&utm_term=curalate_like2buy,
Shrimp Wedge Salad with Old Bay Breadcrumbs and Hot Sauce Dressing,"['1 tablespoon vegetable oil', '20 peeled and deveined raw large shrimp (about 1 pound)', '1/2 teaspoon kosher salt', '1/8 teaspoon black pepper', '1 1/4 cups fresh breadcrumbs (about 3 3/8 ounces)', '1/2 teaspoon Old Bay seasoning', '1/2 cup mayonnaise', '2 tablespoons whole milk', '4 teaspoons hot sauce (such as Crystal)', '1 (20-ounce) head iceberg lettuce, cut into 4 wedges', 'Capers, for garnish']","['Heat oil in a 12-inch nonstick skillet over medium-high. Add shrimp; cook until pink and cooked through, 1 to 2 minutes per side. Sprinkle with salt and pepper. Remove from skillet; set aside.', 'Add breadcrumbs and Old Bay seasoning to skillet; cook over medium, stirring occasionally, until golden brown, about 4 minutes. Remove from heat; set aside.', 'Whisk together mayonnaise, milk, and hot sauce in a small bowl until smooth.', 'Arrange lettuce wedges on a platter. Top with shrimp, dressing, and breadcrumbs. Garnish with capers.']",4,"{'prep': None, 'cook': None, 'total': '20 mins'}","Prepare recipe through step 3 up to 2 days ahead. Store lettuce wedges, shrimp, and dressing in separate containers in refrigerator. Store breadcrumbs in a sealed container at room temperature. Assemble just before serving.",Kelsey Jane Youngman,https://www.foodandwine.com/recipes/shrimp-wedge-salad-old-bay-breadcrumbs-and-hot-sauce-dressing?utm_source=instagram&utm_medium=social&utm_campaign=foodandwine_foodandwine&utm_term=curalate_like2buy,
One-Pot Gingery Chicken and Rice With Peanut Sauce,"['6 small skin-on, bone-in chicken thighs (about 3 lb.)', '¾ tsp. kosher salt, plus more', '2 large shallots, finely chopped', '8 garlic cloves, finely chopped', '1 2"" piece ginger, peeled, finely chopped', '2 cups high-quality basmati rice, rinsed', '2 whole star anise', '1 Tbsp. soy sauce', '½ cup creamy peanut butter', '2 Tbsp. soy sauce', '2 Tbsp. unseasoned rice vinegar', '5 tsp. Sriracha', '1 1"" piece ginger, peeled, finely chopped', '1½ tsp. honey', '1 English hothouse cucumber, halved lengthwise, thinly sliced on a diagonal', '1 cup cilantro leaves with tender stems']","['Pat chicken dry and season all over with salt. Arrange, skin side down, in a cold, dry medium Dutch oven and set over medium heat. Cook, undisturbed, until skin is golden brown and crisp and easily releases from pot, 8–10 minutes. Slide thighs around to different spots (this will ensure even browning) and continue to cook until deeply browned, 3–5 minutes longer. Transfer chicken to a plate. Let pot cool 2 minutes.', 'Set pot over medium-low heat; add shallots, garlic, and ginger and cook, stirring constantly, until very fragrant but not browned, about 2 minutes. Stir in rice and star anise and cook, stirring constantly, 1 minute. Stir in soy sauce, ¾ tsp. salt, and 3 cups water. Nestle chicken back into rice mixture in pot, arranging skin side up. Increase heat to medium and bring liquid to a simmer. Immediately cover pot, reduce heat to low, and cook 25 minutes. Remove from heat and let chicken and rice sit 10 minutes.', 'While the chicken and rice are cooking, make the sauce. Whisk peanut butter, soy sauce, vinegar, Sriracha, ginger, honey, and ¼ cup warm water in a small bowl until smooth and pourable. If sauce still looks a little thick, continuing adding water until it reaches a drizzle-able consistency.', 'Remove lid from pot and fluff rice with a fork. Pluck out and discard star anise. Serve chicken and rice with peanut sauce, cucumber, and cilantro alongside.']",6 servings,"{'prep': None, 'cook': '45 minutes', 'total': None}",Sauce can be made 3 days ahead. Cover and chill.,Molly Baz,https://www.bonappetit.com/recipe/one-pot-chicken-and-rice?utm_campaign=likeshopme&client_service_id=31198&utm_social_type=owned&_gl=1*fycr0b*_ga*YW1wLU96ZnV5cnhaVi1DY1doaFk5NG1XTXJ0VkVfeDFkUmtFMzN2cFlmQzZ1QW93em4xZ3VqeWcwaVpNNHNzalhsS1I.&service_user_id=1.78e+16&utm_content=instagram-bio-link&utm_brand=ba&utm_source=instagram&intcid=inline_amp&utm_medium=social&client_service_name=bonappetitmag&supported_service_name=instagram_publishing,
Coconut Cod Chowder With Seasoned Oyster Crackers,"['1½ lb. skinless, boneless cod or halibut fillets', '2½ tsp. kosher salt, divided, plus more', '5 Tbsp. ghee or unsalted butter, divided', '2 medium leeks, white and pale green parts only, halved lengthwise, thinly sliced crosswise', '6 garlic cloves, thinly sliced', '1 3"" piece ginger, peeled, cut into matchsticks', '¾ tsp. ground turmeric', '¾ tsp. ground coriander', '½ tsp. ground cardamom', '1 serrano chile, thinly sliced', '12 oz. baby Yukon Gold or red potatoes, halved', '2 13.5-oz. cans unsweetened coconut milk', '2 celery stalks, thinly sliced, plus leaves for serving (optional)', '1½ cups oyster crackers', '1 tsp. paprika', '2 limes, divided']","['Season cod all over with 1½ tsp. salt; set aside. Heat 3 Tbsp. ghee in a medium Dutch oven over medium. Cook leeks, garlic, and ginger, stirring occasionally, until softened but not browned, about 3 minutes. Add turmeric, coriander, and cardamom and cook, stirring, until fragrant, about 30 seconds. Add chile, potatoes, coconut milk, 1 tsp. salt, and ¾ cup water; bring to a boil (still over medium). Immediately reduce heat so soup is at a bare simmer. Cover, leaving lid slightly askew, and cook until potatoes are barely fork-tender, 10–12 minutes.', 'Carefully nestle reserved fish into pot, spoon some broth over, and cover, leaving lid slightly askew. Cook at a bare simmer 4 minutes, then stir in celery. Cook until fish is opaque and flakes easily, about 5 minutes. Taste chowder and season with more salt if needed.', 'Meanwhile, heat remaining 2 Tbsp. ghee in a small skillet over medium-low. Add crackers and stir well to coat. Cook, stirring often, until golden brown, about 5 minutes. Remove from heat and add paprika; toss to evenly coat.', 'Slice 1 lime in half and squeeze juice into chowder. Taste and season with more salt if needed. Ladle into bowls, breaking fish into large pieces. Scatter celery leaves over chowder if using and top with crackers. Slice remaining lime into wedges and serve alongside.']",4 servings,"{'prep': None, 'cook': '30 minutes', 'total': None}","Too often fish chowder is heavy, gloppy, and one-note. Not this guy. Coconut milk and lots of zippy aromatics bring life to the dish. And though you may think oyster crackers can’t be improved upon, you’ll change your mind when you try them extra-buttery and smothered in paprika.",Molly Baz,https://www.bonappetit.com/recipe/coconut-cod-chowder?utm_campaign=likeshopme&client_service_id=31198&utm_social_type=owned&utm_brand=ba&service_user_id=1.78e+16&utm_content=instagram-bio-link&utm_source=instagram&utm_medium=social&client_service_name=bonappetitmag&supported_service_name=instagram_publishing,
,,,,,,,https://www.halfbakedharvest.com/cauliflower-shawarma/#bo-recipe,Expecting value: line 1 column 1 (char 0)
,,,,,,,https://thewoodenskillet.com/simple-buffalo-cauliflower-lettuce-wraps/?utm_campaign=later-linkinbio-thewoodenskillet&utm_content=later-5647539&utm_medium=social&utm_source=instagram,Expecting value: line 1 column 1 (char 0)
,,,,,,,https://thewoodenskillet.com/crockpot-cilantro-lime-chicken/?utm_campaign=later-linkinbio-thewoodenskillet&utm_content=later-5697011&utm_medium=social&utm_source=instagram,Expecting value: line 1 column 1 (char 0)
Pickled Red Onion Recipe,[],[],,"{'prep': None, 'cook': None, 'total': None}","The content provided does not include specific details about ingredients, instructions, or time. Please refer to the original source for complete information.",Andrea Hannemann,https://www.instagram.com/p/B7bXnbwAFoT/?igshid=nuzsz58fnrnu,
Harissa Romesco Sauce,"['1 cup of nuts (any mix of almonds, walnuts, cashews, or pine nuts), toasted and cooled', '1 cup Signature Harissa', '2 ½ tablespoons extra-virgin olive oil', '1 tablespoon lemon juice', 'Salt']","['Place nuts, harissa, olive oil, lemon juice, and a generous pinch of salt in a food processor and blend until a uniform paste forms.', 'Taste and add more salt, if desired.']",Makes about 2 cups,"{'prep': None, 'cook': None, 'total': None}","This sauce pairs well with roasted cauliflower, pasta, or as a sandwich spread.",,https://www.nyshuk.com/harissa-romesco-cauliflower,
Khao Soi,"['2 large (6 ounces total) shallots, quartered, peelings and trimmings reserved', '18 garlic cloves (from 2 [2-ounce] heads), peelings and trimmings reserved', '1 1/2 ounces daikon radish, peeled and cut into large pieces (about 1/2 cup), peelings and trimmings reserved', '1 (1/2-ounce) lemongrass stalk, cut into small pieces (about 1/4 cup), tough outer leaves and trimmings reserved', '1/4 cup vegetable oil', '1 small (4-ounce) white onion, thinly sliced (about 1 cup), peelings and trimmings reserved', '1 pound cherry tomatoes, halved (about 3 cups)', '1 pound ground pork', '12 cups, plus 2 tablespoons water, divided', '1/2 cup soybean paste', '1 1/2 tablespoons red pepper powder', '1 tablespoon paprika', '1 tablespoon palm sugar', '1 tablespoon granulated sugar', '1/2 teaspoon black pepper', '4 1/2 tablespoons fish sauce, divided', '1/2 cup galangal, peeled and grated with microplane grater', '1 (32-ounce) package fresh rice noodles or 1 pound dried rice noodles', '1 tablespoon kosher salt', 'Garnishes: mint leaves, cilantro leaves, thinly sliced green onion, and halved lengthwise beech mushrooms']","['Pulse shallots in a food processor until finely chopped, about 10 pulses. Transfer shallots to a bowl, and set aside. Pulse garlic in food processor until finely chopped, about 6 pulses. Transfer to a separate bowl, and set aside. Pulse radish and lemongrass in food processor until finely chopped, about 10 pulses. Transfer to a separate bowl, and set aside.', 'Heat oil in a medium Dutch oven over medium-high. Add onion and reserved shallots; cook, stirring constantly, until fragrant, about 30 seconds. Add reserved garlic; cook, stirring often, until onion and shallots are translucent, about 3 minutes. Add tomatoes and reserved radish-lemongrass mixture; cook, stirring often, until fragrant and tomatoes begin to soften, about 2 minutes. Add ground pork; cook, stirring constantly, until pork is broken into small pieces, about 1 minute. Add 2 tablespoons of the water. Reduce heat to low; cook, stirring often, until pork is no longer pink, about 15 minutes. Add soybean paste, red pepper powder, paprika, palm sugar, granulated sugar, black pepper, and 1 1/2 tablespoons of the fish sauce, stirring until evenly combined. Increase heat to medium; cook, stirring often, until slightly thickened, about 10 minutes. Reduce heat to low; cook, stirring occasionally, until thickened, about 10 minutes. Turn off heat; stir in grated galangal. Cover pork sauce, and keep warm using residual heat from burner.', 'During final 10 minutes of pork sauce cooking, bring remaining 12 cups water in a large saucepan to a boil over medium-high. Reduce heat to medium; add rice noodles, stirring once, until softened, 30 to 40 seconds for fresh noodles or 2 to 3 minutes for dried noodles. (If using dried noodles, soak in warm water for 10 minutes before boiling noodles.) Transfer noodles to a colander using a slotted spoon, and drain well; reserve cooking water in saucepan. Place noodles in a large bowl; cover with cold water, and set aside. Add reserved shallot, garlic, radish, lemongrass, and onion peelings and trimmings to cooking water in saucepan; add salt and remaining 3 tablespoons fish sauce. Bring to a simmer over medium; simmer, stirring occasionally, 20 minutes. Pour broth through a fine mesh strainer into a large bowl, discarding solids.', 'Drain reserved noodles. Divide noodles evenly among 6 bowls (about 1 1/3 cups each). Top evenly with pork sauce (about 3/4 cup each), and add about 1 2/3 cups broth to each bowl; garnish with mint, cilantro, green onion, and mushrooms.']",6 servings,"{'prep': '1 hr 35 mins', 'cook': '1 hr 35 mins', 'total': '1 hr 35 mins'}","An aromatic mixture made of shallot, garlic, and radish is the base of this riff on the Northern Thai classic from chef Donny Sirisavath. He amps up the flavor with soybean paste, cherry tomatoes, and ground pork to create a deeply savory pork sauce. Red pepper flakes, black pepper, and palm sugar act as a balancing act to the spices and aromatics in the sauce.",Donny Sirisavath,https://www.foodandwine.com/recipes/laotian-khao-soi?utm_source=instagram&utm_medium=social&utm_campaign=foodandwine_foodandwine&utm_term=curalate_like2buy,
"Restoration Salad with Farro, Orange, and Blue Cheese","['3 whole cloves', '1/2 medium yellow onion', '1 1/2 quarts water', '1 cup uncooked whole-grain farro (such as Bob’s Red Mill)', '1 dried bay leaf', '3 medium navel oranges', '1/4 cup golden raisins', '1/4 cup extra-virgin olive oil', '2 tablespoons white balsamic vinegar', '1 tablespoon minced shallot', '1 teaspoon Dijon mustard', '1/2 teaspoon kosher salt', '1/2 teaspoon black pepper', '8 ounces brussels sprouts, trimmed and very thinly sliced', '1/2 cup walnut halves, toasted', '4 ounces firm blue cheese, cut into 4 slices']","['Poke cloves into the cut side of the onion half. Combine cloved onion half, 1 1/2 quarts water, farro, and bay leaf in a large saucepan; bring to a boil over high. Reduce heat to medium; cook, uncovered, until farro is chewy-tender, about 20 minutes. Drain and rinse with cold water. Discard onion and bay leaf.', 'While farro is cooking, grate 1 orange to equal 1/2 teaspoon zest, and set aside. Peel oranges with a knife, removing all white pith. Section oranges over a bowl, reserving juice (about 1/3 cup). Squeeze membranes to extract juice; discard membranes.', 'Place raisins in a small microwavable bowl; pour orange juice over raisins. Microwave at HIGH 1 minute. Place raisins and any unabsorbed juice in a large bowl; let cool slightly.', 'Combine oil, vinegar, shallot, mustard, salt, pepper, and reserved orange zest in a small jar. Seal and shake to emulsify. Add farro, brussels sprouts, and orange segments to the bowl with raisins.']",4,"{'prep': '25 mins', 'cook': None, 'total': '35 mins'}",Store walnuts separately to retain crunch if preparing in advance.,Ann Taylor Pittman,https://www.foodandwine.com/recipes/restoration-salad-farro-orange-and-blue-cheese?utm_source=instagram&utm_medium=social&utm_campaign=foodandwine_foodandwine&utm_term=curalate_like2buy,
Escarole Caesar With Sardines and Hazelnuts,"['½ cup blanched hazelnuts', '1 3.75-oz. can sardines, drained', '1 garlic clove, finely grated', '2 Tbsp. fresh lemon juice', '1 tsp. Dijon mustard', '½ tsp. freshly ground black pepper, plus more', '1½ oz. Piave cheese or Parmesan, divided', '½ cup mayonnaise', '2 Tbsp. extra-virgin olive oil', 'Kosher salt', '1 large head or 2 small heads of escarole (about 1½ lb.), wilted outer leaves removed, inner leaves torn into large pieces', 'Lemon wedges (for serving)']","['Preheat oven to 325°. Toast hazelnuts on a rimmed baking sheet until deep golden brown, 12–15 minutes. Let cool, then crush or coarsely chop.', 'Open each sardine with the tip of a paring knife, prying the fillets apart. Remove any bones. Finely chop 2 sardines and transfer to a large bowl. Add garlic, lemon juice, mustard, and ½ tsp. pepper and whisk to combine. Finely grate 1 oz. Piave (about two-thirds) into bowl and add mayonnaise and oil; whisk to combine. Season dressing with salt.', 'Add escarole and three-fourths of hazelnuts to bowl with dressing and toss well to coat; season with salt and pepper.', 'Divide salad among plates, top with remaining hazelnuts. Shave remaining ½ oz. Piave over and break remaining sardines into smaller pieces and scatter on top. Serve with lemon wedges for squeezing over.']",4 servings,"{'prep': None, 'cook': '12–15 minutes', 'total': None}","When looking for a sustainable fish option, go for lower-on-the-food-chain guys like sardines. They’re in their full glory in this umami-packed twist on Caesar.",Molly Baz,https://www.bonappetit.com/recipe/escarole-caesar-with-sardines-and-hazelnuts,
,,,,,,,https://www.masterclass.com/articles/how-to-make-homemade-birria#birria-recipe,Expecting value: line 1 column 1 (char 0)
Low Carb Keto/Paleo Waffles,"['1/2 cup almond flour', '1/2 cup tigernut flour', '4 Tbsp ground flaxseed', '1-1/2 tsp baking powder', '1/4 tsp sea salt', '1 tsp cinnamon', '1 pkg of dry or 4 drops liquid stevia (optional)', '2 Tbsp melted coconut oil (or butter or ghee)', '6 drops liquid stevia (or 1 packet of powder)', '3 large eggs', '1 cup coconut milk (blend 2 Tbsp coconut cream + balance of water to 1 cup mark for 30 sec)']","['Pre-heat an electric waffle maker.', 'While warming waffle maker, mix all dry ingredients in a small bowl and whisk with a fork to combine.', 'Add all wet ingredients on top of the dry (in the same bowl) and whisk until batter is smooth.', 'For a waffle maker that makes 2 square waffles at a time, scoop ~1/4 cup of batter into each square (until just covered) and close the lid until the light indicates the waffle is done. Leave in an extra minute for a crisper waffle.', 'Set cooked waffles on a cooking rack or in a warm oven to prevent them from getting soggy.', 'Serve topped with butter, a low carb monkfruit syrup, coconut cream, and/or nut butter.']",4 servings (2 waffles each),"{'prep': None, 'cook': None, 'total': None}",The waffles freeze and reheat really well. They can be used for camping or backpacking and should hold together enough to make a sandwich.,Jamie,https://dailybagofgoodness.com/2018/04/18/lowcarbwaffles/,
Whipped Matcha (Dalgona Matcha) Two Ways,"['2 large egg whites', '1/4 cup sugar', '1 tbsp matcha', 'milk of choice', '1 cup heavy whipping cream (cold)']","['Make the simple syrup: mix 1/4 cup sugar with 1/4 cup boiling water and stir until the sugar dissolves. Set aside.', 'Add the egg whites to a bowl (either a regular bowl or the bowl of a stand mixer). Whip the eggs on high until they start to turn frothy.', 'When the eggs are frothy, slowly stream in the simple syrup while beating on high. Whip until the eggs start to turn white and form soft peaks.', 'Sift the matcha powder on the eggs then continue to whip on high until smooth and creamy. Don’t over whip or the eggs will turn into a stiff meringue and the dalgona matcha won’t flow.', 'Fill two glasses with ice and pour in your milk of choice. Top the glasses with a generous amount of fluffy matcha. Stir thoroughly before enjoying!']",Serves 4,"{'prep': '5 minutes', 'cook': '10 minutes', 'total': '15 minutes'}",,Stephanie,https://iamafoodblog.com/how-to-make-whipped-matcha-dalgona-matcha-two-ways-tips/,
