title,ingredients,instructions,yield,time,notes,author,source_url,error
BA’s Best Eggplant Parmesan,"['¼ cup extra-virgin olive oil', '1 head of garlic, cloves crushed', '1 large red onion, chopped', '3 oil-packed anchovy fillets (optional)', '½ tsp. crushed red pepper flakes', '1 Tbsp. tomato paste', '¼ cup dry white wine', '2 (28-oz.) cans whole peeled tomatoes', '¼ cup torn basil leaves', '½ tsp. dried oregano', 'Kosher salt', '4 lb. Italian eggplants (about 4 medium eggplants), peeled, sliced lengthwise ½""–¾"" thick', 'Kosher salt', '3 cups panko breadcrumbs', '1½ tsp. dried oregano', '1 tsp. freshly ground black pepper', '1½ cups finely grated Parmesan, divided', '1½ cups (187.5 g) all-purpose flour', '5 large eggs, beaten to blend', '1⅓ cups extra-virgin olive oil, divided', '½ cup finely chopped basil and parsley, plus basil leaves for serving', '6 oz. low-moisture mozzarella cheese, grated (about 1⅓ cups)', '8 oz. fresh mozzarella cheese, thinly sliced']","['Preheat oven to 350°. Place a Dutch oven or other large heavy ovenproof pot over medium heat. Add ¼ cup extra-virgin olive oil and 1 head of garlic, cloves crushed, and cook, stirring often, until garlic is golden, about 4 minutes.', 'Add 1 large red onion, chopped, 3 oil-packed anchovy fillets (if using), and ½ tsp. crushed red pepper flakes and cook, stirring often, until onion is translucent, about 5 minutes.', 'Stir in 1 Tbsp. tomato paste and cook, stirring often, until slightly darkened, about 2 minutes.', 'Add ¼ cup dry white wine, bring to a boil, and cook until almost completely evaporated, about 1 minute.', 'Add two 28-oz. cans whole peeled tomatoes, breaking up with your hands, and their juices; add ¼ cup torn basil leaves and ½ tsp. dried oregano and stir to combine.', 'Swirl 1½ cups water into one tomato can, then the other, to rinse, and add to pot; season with kosher salt.', 'Transfer pot to oven; roast sauce, stirring halfway through, until thick and tomatoes are browned on top and around edges of pot, 2–2½ hours.', 'Let sauce cool slightly. Pass through the large holes of a food mill or process in a food processor until mostly smooth. Taste and season with salt.', 'Lightly season 4 lb. Italian eggplants (about 4 medium eggplants), peeled, sliced lengthwise ½""–¾"" thick, all over with kosher salt; place in a single layer on several layers of paper towels inside a rimmed baking sheet.', 'Top with another layer of paper towels and more slices; repeat as needed. Top with a final layer of paper towels, then another rimmed baking sheet; weigh down with a heavy pot. Let sliced eggplant sit until it has released excess liquid, 45–60 minutes.', 'Meanwhile, pulse 3 cups panko breadcrumbs, 1½ tsp. dried oregano, 1 tsp. freshly ground black pepper, and ¾ cup finely grated Parmesan cheese in a food processor until very finely ground. Transfer to a shallow bowl.', 'Preheat oven to 350°. Place 1½ cups (187.5 g) all-purpose flour in another shallow bowl and 5 large eggs, beaten to blend, in a third shallow bowl.', 'Working one at a time, dredge eggplant slices in flour, then dip in egg, allowing excess to drip off. Coat in breadcrumb mixture, packing all around, then shaking off excess.']",12 servings,"{'prep': None, 'cook': None, 'total': '4 hours 30 minutes'}","The homemade marinara sauce makes all the difference, so don’t swap it out for store-bought. This one is rich with tomato, wine, tons of garlic, and anchovies (the secret to everything) and can be made up to two days ahead.",Claire Saffitz,https://www.bonappetit.com/recipe/bas-best-eggplant-parmesan,
400 Error: Bad Request,[],[],,"{'prep': None, 'cook': None, 'total': None}",,,http://thenaughtyfork.com/index.php/2016/09/29/levain-cookie-2-0/,
Best Loaded Cauliflower Bake,"['2 small heads cauliflower, cut into florets', '2 Tbsp. butter', '3 cloves garlic, minced', '3 Tbsp. all-purpose flour', '2 cups whole milk', '2 oz. cream cheese, softened', '1 1/2 cups shredded cheddar, divided', 'Kosher salt', 'Freshly ground black pepper', '6 slices bacon, cooked and crumbled', '1/4 cup sliced green onions']","['Preheat oven to 350°. In a large pot of salted boiling water, blanch cauliflower, 3 minutes. Drain and squeeze cauliflower of water.', 'Make cheese sauce: In a large skillet, melt butter. Add garlic and cook until fragrant, 1 minute, then add flour and stir until golden, 2 minutes. Add milk and bring to a low simmer, then add cream cheese, whisking until combined. Remove from heat and stir in 1 cup cheddar until melted, then season with salt and pepper.', 'In a 9”-x-13” dish, add drained cauliflower. Pour over cheese sauce and stir until combined. Stir in all but 1 tablespoon each cooked bacon and green onions until combined, then top with remaining cheddar, bacon, and green onions.', 'Bake until cauliflower is tender and cheese is melty, 30 minutes.']",8 serving(s),"{'prep': '15 mins', 'cook': '45 mins', 'total': '1 hr'}",You definitely want to cook the cauliflower a little first so that it doesn't take forever in the oven. Blanch it for around 3 minutes before draining it of any excess water.,Lindsay Funston,https://www.delish.com/cooking/recipe-ideas/recipes/a49535/loaded-cauliflower-bake-recipe/,
Pork Posole Recipe,"['1 cup all-purpose flour', '½ tablespoon kosher salt, plus more to taste', '½ tablespoon freshly ground black pepper', '1 teaspoon ground cumin', '3 pounds pork shoulder, cut into 3-inch pieces', '3 tablespoons lard, divided', '3 tablespoons olive oil, divided', '4 garlic cloves, minced', '1 yellow onion, finely chopped', '4 cups water', '1½ tablespoons minced oregano', '¾ tablespoon cumin seeds, toasted', '2 bay leaves', '1½ cups fresh corn kernels', '1 pound (6 medium) tomatillos', '2¼ cups canned hominy, rinsed', '1 cup roasted red peppers, diced', '1 jalapeno—stemmed, seeded and minced', 'Crumbled cotija cheese, for garnish', 'Cilantro leaves, for garnish']","['Preheat the oven to 350º. In a large bowl, whisk together the flour, salt, pepper and cumin. Toss the pork shoulder in the flour to dredge, shaking off any excess flour.', ""In a 6-quart Dutch oven, heat 1½ tablespoons of the lard and 2 tablespoons of the olive oil over medium heat. Working in 2 batches, sear the pork, turning as needed until golden brown, 7 to 10 minutes per batch. Watch the pork carefully to make sure any excess flour in the pan doesn't burn. Once seared, transfer to a plate lined with paper towels."", 'To the pot, add the remaining lard, the garlic and onions. Cook until translucent, 2 to 3 minutes. Return the pork to the pan with the water, oregano, cumin seeds and bay leaves. Bring to a boil, then reduce to a very low simmer and cook, covered, over low heat until the pork is tender, 2 hours.', 'Meanwhile, on a baking sheet toss the corn with the remaining 1 tablespoon of olive oil. Bake until golden brown, 12 to 14 minutes, then set aside.', 'Once the pork has simmered for 2 hours, add the roasted corn, tomatillos, hominy, roasted red peppers and jalapeño. Return to a low simmer and cook, covered, until the pork begins to fall apart, 1 hour more.', 'Using 2 forks, shred the pork into bite-sized pieces. Ladle the posole into bowls and garnish with the cotija cheese and cilantro leaves, then serve.']",8 to 10 servings,"{'prep': '20 minutes', 'cook': '3.33 hours', 'total': '3 hours, 40 minutes'}","Recipe adapted from 'Big Bad Breakfast,' by John Currence",Tasting Table Staff,https://www.tastingtable.com/cook/recipes/pork-posole-recipe-mexican-corn-soup,
BA's Best Guacamole,"['3 large ripe Hass avocados', '¼ white onion, finely chopped', '1 serrano chile, seeds removed if desired, finely chopped', '1 garlic clove, finely grated', '2 tablespoons (or more) fresh lime juice', '1 teaspoon kosher salt', '¼ cup chopped cilantro, plus more for serving', 'Toasted pepitas (pumpkin seeds; optional) and chips (for serving)']","['Smash avocados with a potato masher or fork in a medium bowl or with a molcajete (a Mexican mortar and pestle) until very coarsely mashed.', 'Mix in onion, chile, garlic, lime juice, salt, and ¼ cup cilantro.', 'Taste and add more lime juice, if desired.', 'Top with pepitas (if using) and more cilantro; serve with chips alongside.']",Makes about 3 cups,"{'prep': None, 'cook': None, 'total': None}",This recipe was originally published in Bon Appétit's October 2016 issue.,Rick Martinez,https://www.bonappetit.com/recipe/bas-best-guacamole,
Mille-Crepe Tiramisu Birthday Cake,"['¾ cup plus 2 tablespoons cake flour', '¾ cup plus 1 tablespoon all-purpose flour', '¼ cup granulated sugar', '2 teaspoons kosher salt', '4 large eggs', '5 large egg yolks', '1 stick (8 tablespoons) unsalted butter, melted and cooled slightly', '2 cups whole milk', '3 tablespoons Armagnac or cognac', ""1¼ cups confectioners' sugar"", '4 cups mascarpone cheese', '½ cup sweet Marsala wine (or half as much rum or coffee liqueur)', '¼ cup natural cocoa powder']","['Make the crepe batter: In a fine-mesh sieve set over a medium bowl, sift together the cake flour, all-purpose flour and sugar. Whisk in the salt. In another medium bowl, whisk together the eggs and egg yolks. Add the egg mixture to the flour mixture and whisk until smooth and webby (it will be very thick). In a slow, steady stream, whisk in the butter, then the milk and the Armagnac, until the batter is smooth (if there are any lumps, strain the batter through a fine-mesh sieve and into a medium bowl). Cover the bowl with plastic wrap and refrigerate for 1 hour.', ""Line a baking sheet with parchment paper. Set an 8-inch nonstick skillet over medium-high heat. Gently stir the crêpe batter, then pour ¼ cup of batter into the skillet. Holding the skillet by the handle, tilt and turn the skillet to quickly disperse the batter. Cook the crepe until the underside is golden-brown, about 1½ minutes. Lightly jerk the skillet to loosen the crepe, then flip the crepe over using a spatula, a more vigorous jerking motion or your fingers. Cook on the other side until golden-brown, about 30 seconds, then slide the crepe onto the parchment-paper-lined baking sheet. Repeat until all of the batter is used (you'll end up with about 20 crepes total, and will need 18 for the cake). Refrigerate the crepes on the baking sheet until completely chilled, at least 2 hours or overnight."", ""Make the tiramisu filling: In a fine-mesh sieve set over the bowl of a stand mixer, sift the confectioners' sugar. Add the mascarpone cheese and the Marsala wine. Use the paddle attachment to combine the mixture on low speed until well combined."", ""Remove the crepes from the refrigerator. Add 1 crepe to the bottom of an 8-inch springform pan so it lies flat. Add ¼ cup of the tiramisu filling to the center of the crepe and use a small offset spatula to evenly spread the filling over the crêpe. Repeat with the filling and 17 more crêpes. Refrigerate the leftover filling; you'll use it to finish the cake. Chill the cake in the refrigerator for at least 2 hours or overnight."", 'Remove the cake from the refrigerator, undo the springform pan and set it on a cake plate or platter. Spread the remaining tiramisu cream on top of the cake. Add the cocoa powder to a fine-mesh sieve and sprinkle it over the top of the cake. Slice and serve.']",8 servings,"{'prep': None, 'cook': None, 'total': None}",The recipe gives an illusion of complexity with its many layers.,Tasting Table Staff,https://www.tastingtable.com/cook/recipes/Mille-Crepe-Tiramisu-Birthday-Cake-Recipe,
Skillet-Roasted Lemon Chicken,"['2 teaspoons fresh thyme leaves', '1 teaspoon whole fennel seeds', 'kosher salt, to taste', 'freshly ground black pepper, to taste', '⅓ cup good olive oil', '1 lemon, halved and sliced ¼ inch thick', '1 yellow onion, halved and sliced ¼ inch thick', '2 large garlic cloves, thinly sliced', '1 (4-pound) chicken, backbone removed and butterflied', '½ cup dry white wine, such as Pinot Grigio', 'juice of 1 lemon']","['Preheat the oven to 450 F.', 'Place the thyme, fennel seeds, 1 tablespoon salt, and 1 teaspoon pepper in a mini food processor and process until ground.', 'Pour the olive oil into a small glass measuring cup, stir in the herb mixture, and set aside.', 'Distribute the lemon slices in a 12-inch cast-iron skillet and distribute the onion and garlic on top. Place the chicken, skin side down, on top of the onion and brush with about half the oil and herb mixture. Turn the chicken skin side up, pat it dry with paper towels (very important!), and brush it all over with the rest of the oil and herb mixture.', 'Roast the chicken for 30 minutes.', 'Pour the wine into the pan (not on the chicken!) and roast for another 10 to 15 minutes, until a meat thermometer inserted into the thickest part of the breast registers 155 to 160 F.', 'Remove the chicken from the oven, sprinkle it with the lemon juice, cover the skillet tightly with aluminum foil, and allow to rest for 10 to 15 minutes.', 'Cut the chicken into quarters or eighths, sprinkle with salt, and serve hot with the pan juices, cooked lemon, and onion.']",3 servings,"{'prep': '15 minutes', 'cook': '40 minutes', 'total': '55 minutes'}",Garnish with minced fresh rosemary before resting. You can also assemble the chicken in advance in the pan then refrigerate to save time on the day of serving.,Ina Garten,https://www.tastingtable.com/cook/recipes/skillet-roasted-lemon-chicken-recipe-ina-garten,
,,,,,,,http://damndelicious.net/2016/10/27/slow-cooker-chicken-noodle-soup/,Expecting value: line 1 column 1 (char 0)
Pico de Gallo Verde,"['4 medium Persian cucumbers, finely chopped', '1 avocado, finely chopped', '1 celery stalk, finely chopped, plus ¼ cup finely chopped celery leaves', '2 scallions, green parts only, thinly sliced', '1 small poblano chile, seeds removed, finely chopped', '1 jalapeño, seeds removed, finely chopped', '1 garlic clove, finely grated', '¼ cup finely chopped unsalted, roasted pistachios', '¼ cup fresh lime juice', '2 tablespoons finely chopped cilantro', '2 tablespoons finely chopped mint', 'Olive oil (for drizzling)', 'Kosher salt', 'Tortilla chips or plantain chips (for serving)']","['Toss cucumbers, avocado, celery and celery leaves, scallions, poblano, jalapeño, garlic, pistachios, lime juice, cilantro, and mint in a large bowl. (Mixture should be coated just enough to look glossy.)', 'Drizzle with oil, season with salt, and toss again.', 'Cover salsa and chill 20 minutes before serving with chips.']",8 Servings,"{'prep': None, 'cook': None, 'total': None}","The lime juice and oil will keep the avocado from turning brown, but it’s a good idea to make this salsa right before you serve it.",Andy Baraghani,https://www.bonappetit.com/recipe/pico-de-gallo-verde,
White Lasagna With Sausage And Ricotta,"['Uncooked Italian sausage', 'Baby spinach', 'Yellow onion', 'Fresh thyme', 'Fresh sage', 'Crushed red pepper flakes', 'White wine', 'Balsamic glaze', 'Unsalted butter', 'Flour', 'Whole milk', 'Whole milk ricotta', 'Salt', 'Pepper', 'Nutmeg', 'Garlic powder', 'Finely grated Parmesan', 'Shredded mozzarella', 'Lasagna noodles']","['Preheat the oven to 350 F.', 'Remove the sausage from its casing and cook in a non-stick pan, breaking it up with a wooden spoon. Once cooked, remove from pan and chop into smaller pieces if needed.', 'In the same pan, melt butter with the sausage fat. Add thinly sliced onions, fresh herbs, and red pepper flakes. Cook until onions are golden brown.', 'Add white wine to the onions, bring to a boil, and let it evaporate. Stir in balsamic glaze and remove onions from the pan.', 'Place spinach in the pan and cook until wilted.', 'For the béchamel, melt butter and add flour to make a blonde roux. Slowly whisk in milk until smooth.', 'Remove béchamel from heat and fold in ricotta, salt, pepper, nutmeg, and garlic powder.', 'Spread a quarter of the ricotta béchamel over the bottom of a baking dish. Top with a layer of lasagna sheets.', 'Add a layer of cooked sausage, caramelized onions, and spinach. Sprinkle with Parmesan and mozzarella.', 'Repeat layers, ending with béchamel and cheese on top.', 'Bake in the oven until golden and bubbly.']",,"{'prep': None, 'cook': None, 'total': None}",Lasagna is delicious on its own or served with Caesar salad.,Ali Fagan,https://www.tastingtable.com/cook/recipes/sausage-ricotta-lasagna-recipe-pasta-cheese-recipe?utm_medium=email&utm_source=TT&utm_campaign=Daily&utm_content=Editorial,
Classic Tiramisu Recipe,"['2 egg yolks', '¼ cup sugar', '1 cup mascarpone, softened', '¾ cup heavy cream', '10 ladyfingers', '1 cup strong brewed coffee or espresso at room temperature', '2 tablespoons unsweetened cacao or cocoa powder']","['In a medium bowl, whisk the egg yolks with sugar until pale and fluffy.', 'Mix mascarpone into the egg mixture until smooth.', 'In a separate bowl, whip the heavy cream to form stiff peaks then fold it into the mascarpone mixture.', 'Dip the ladyfingers into the cold coffee and layer them in an 8x5-inch serving dish that is 2 inches in height.', 'Cover the ladyfingers with the mascarpone cream and smooth out the top.', 'Refrigerate the tiramisu for at least 6 hours.', 'Dust the chilled tiramisu with cacao powder before serving.']",4 servings,"{'prep': '6 hours, 20 minutes', 'cook': '0 minutes', 'total': '6 hours, 20 minutes'}","Tiramisu is best eaten within a day or two, although it will last up to four days in the fridge. If you can't eat it all within that time frame, you can also wrap it tightly in plastic wrap and stick it in the freezer. In this case, freeze it before sprinkling on the cacao powder.",Eric Ngo and Tasting Table Staff,https://www.tastingtable.com/cook/recipes/How-to-Make-Tiramisu,
,,,,,,,http://www.vogue.com/13514243/hanukkah-party-new-traditions-and-ideas/,Expecting value: line 1 column 1 (char 0)
,[],[],,"{'prep': None, 'cook': None, 'total': None}",,,https://www.jamesbeard.org/recipes/makeover-broccoli-mac-cheese-2,
Manicotti,"['6 large eggs', '1¼ (156 g) cups all-purpose flour', '½ tsp. Diamond Crystal or ¼ tsp. Morton kosher salt', 'Nonstick vegetable oil spray', '2 large egg yolks, beaten to blend', '1½ lb. whole-milk ricotta', '8 oz. low-moisture mozzarella, grated', '1 oz. Parmesan, grated, plus more for serving', 'Kosher salt and freshly ground black pepper', '2 10-oz. boxes frozen chopped spinach, thawed, drained (optional)', '3 cups marinara sauce, preferably homemade, divided', 'Extra-virgin olive oil for serving (optional)']","['Using an electric mixer on high speed, beat 6 large eggs in a large bowl until light, airy, pale in color, and can nearly hold peaks, 6–8 minutes.', 'Reduce mixer speed to low. Gradually add 1¼ (156 g) cups all-purpose flour and ½ tsp. Diamond Crystal or ¼ tsp. Morton kosher salt, beating well between additions, until no clumps of flour remain. With mixer speed on low, slowly pour in 1½ cups water and continue to beat until well incorporated. Cover and let batter rest at least 2 hours.', 'Heat a small nonstick skillet over medium and spray with nonstick vegetable oil spray. Pour 2 Tbsp. batter into skillet and cook, swirling skillet constantly to encourage crepe to form a nice round shape, until set, 15–20 seconds. Tap out crepe onto a clean towel; gently flatten any creases. Repeat with remaining batter.', 'Preheat oven to 350°. Mix 2 large egg yolks, beaten to blend, 1½ lb. ricotta, 8 oz. mozzarella, grated, and 1 oz. Parmesan, grated, in a large bowl; season with kosher salt and freshly ground black pepper. Squeeze out excess liquid from two 10-oz. boxes frozen chopped spinach, thawed, drained (if using), and add to egg mixture; toss to coat.', 'Spread 1 cup marinara sauce, preferably homemade, in a 13x9"" baking dish. Working one at a time, spoon 2 Tbsp. cheese mixture in center of crepe, spreading all the way to the ends. Roll up crepe, then flatten slightly with your hands. Transfer seam side down to prepared dish. Working in batches if needed, repeat with remaining crepes and filling, leaving a small gap in between each. Top with remaining sauce (2 cups marinara) and cover with foil.', 'Bake manicotti until cheese is melted and sauce is bubbling, 35–45 minutes. Let manicotti cool slightly in dish to set, about 15 minutes. Top with a drizzle of extra-virgin olive oil (if using), Parmesan, and freshly ground black pepper before serving.']",6–8 servings,"{'prep': None, 'cook': None, 'total': '3 hours 30 minutes'}","Making crespelle may take a bit of getting used to, so don’t be discouraged if the first few tries aren’t perfect. The work is easily split up over two days: On the first, make the ricotta mixture and the pasta sauce and refrigerate both. On the second, make the crespelle and assemble. Double the recipe for maximum efficiency, then pop one in the freezer to bake a few weeks later.",Brad Leone,https://www.bonappetit.com/recipe/manicotti,
Herby Avocado Hummus,[],[],,"{'prep': None, 'cook': None, 'total': None}","The webpage primarily discusses a taste test of tortilla chips rather than providing a specific recipe. The mention of 'Herby Avocado Hummus' suggests a recipe, but no details are provided.",Ashley Mason,https://www.bonappetit.com/story/best-tortilla-chip-brand-taste-test,
,[],[],,"{'prep': None, 'cook': None, 'total': None}","Access to the webpage was denied, so recipe details are unavailable.",,https://www.thekitchn.com/recipe-pantry-cocoa-brownies-240312,
Porchetta Shoulder Roast with Spicy Chimichurri,"['2 tablespoons chopped oregano', '2 tablespoons chopped rosemary', '2 tablespoons chopped sage', '2 tablespoons fennel pollen or ground fennel seeds', '5 garlic cloves', 'Kosher salt', '3 tablespoons Dijon mustard', '1 6–7-pound skinless, boneless pork shoulder (Boston butt), fat trimmed to ¼ inch thick', 'Freshly ground black pepper', '2 small shallots, finely chopped', '3 garlic cloves, finely grated', '2 small jalapeños, finely chopped', '2 cups finely chopped parsley', '½ cup finely chopped cilantro', '½ cup finely chopped oregano', '⅔ cup olive oil', '¼ cup red wine vinegar']","['Mix oregano, rosemary, sage, and fennel pollen in a small bowl to combine.', 'Using a mortar and pestle, pound the garlic and a pinch of salt to a smooth paste. Mix in mustard. (If you don’t have a mortar and pestle, use a microplane to finely grate the garlic and stir into mustard and salt.)', 'Generously season pork with salt and pepper, sprinkling salt more heavily on the meat than on the layer of fat. Smear garlic mixture all over meat, then sprinkle with the herb mixture, massaging into mustard so it adheres to pork.', 'Roll pork as tightly as you can and tie individual lengths of kitchen twine around roast every 1"" or so. Wrap tightly and chill overnight at least 1 hour.', 'Let pork sit at room temperature 1 hour before roasting.', 'Place a rack in center of oven; preheat to 475°. Place pork on a wire rack set inside a foil-lined rimmed baking sheet. Roast until exterior is deep golden brown, 35–45 minutes. Reduce oven temperature to 300° and continue to roast, checking after 90 minutes just to see how the cooking is progressing, until an instant-read thermometer inserted into the thickest part of pork registers 180°, 2\u2009½–3 hours. Remove pork from oven, cover loosely with foil, and let rest about 30 minutes.', 'While pork is resting, mix shallot, garlic, jalapeño, parsley, cilantro, oregano, oil, and vinegar in a medium bowl; season with salt and pepper and let sit 10 minutes to allow the flavors to meld.', 'To serve, thinly slice porchetta and serve with chimichurri.']",12 servings,"{'prep': '1 hour (plus overnight chilling)', 'cook': '3-3.5 hours', 'total': '4-4.5 hours (plus overnight chilling)'}","Talk to your butcher and let them know you’ll be making porchetta out of the shoulder roast. They’ll butterfly the roast for you, which will make it easier to roll.",Elizabeth Prueitt,https://www.bonappetit.com/recipe/porchetta-shoulder-roast-with-spicy-chimichurri,
,[],[],,"{'prep': None, 'cook': None, 'total': None}",,,https://www.google.com/amp/www.foodrepublic.com/2017/02/22/creative-rice-dishes-for-dinner/amp/,
